{
  "schema_version": 1,
  "name": "tunnel-direct-single-factor-formal",
  "description": "Randomized direct-WebRTC single-factor delay, jitter, loss, and bandwidth matrix.",
  "seed": 20260723,
  "repetitions": 5,
  "warmup_seconds": 10,
  "observation_seconds": 60,
  "sample_interval_seconds": 2,
  "adapter": {
    "type": "docker-netem-tunnel-monitor-v1",
    "netem_container": "tunnel-fish_front_whip-1",
    "netem_device": "eth0",
    "monitor_container": "tunnel-monitor",
    "snapshot_url": "http://127.0.0.1:9010/api/snapshot",
    "stream": "fish_front",
    "ready_timeout_seconds": 90,
    "max_clock_uncertainty_ms": 20,
    "minimum_ready_fraction": 0.8,
    "minimum_clock_valid_fraction": 0.8,
    "guard_pid_file": "/tmp/netem-fish-front-guard.pid"
  },
  "conditions": [
    { "name": "clear", "impairment": { "clear": true } },
    { "name": "delay20", "impairment": { "delay_ms": 20 } },
    { "name": "delay50", "impairment": { "delay_ms": 50 } },
    { "name": "delay100", "impairment": { "delay_ms": 100 } },
    { "name": "delay200", "impairment": { "delay_ms": 200 } },
    { "name": "jitter-control", "impairment": { "delay_ms": 50 } },
    { "name": "jitter5", "impairment": { "delay_ms": 50, "jitter_ms": 5 } },
    { "name": "jitter10", "impairment": { "delay_ms": 50, "jitter_ms": 10 } },
    { "name": "jitter20", "impairment": { "delay_ms": 50, "jitter_ms": 20 } },
    { "name": "jitter40", "impairment": { "delay_ms": 50, "jitter_ms": 40 } },
    { "name": "loss0.1", "impairment": { "loss_percent": 0.1 } },
    { "name": "loss0.5", "impairment": { "loss_percent": 0.5 } },
    { "name": "loss1", "impairment": { "loss_percent": 1 } },
    { "name": "loss2", "impairment": { "loss_percent": 2 } },
    { "name": "loss5", "impairment": { "loss_percent": 5 } },
    { "name": "rate10", "impairment": { "rate_mbps": 10 } },
    { "name": "rate5", "impairment": { "rate_mbps": 5 } },
    { "name": "rate3", "impairment": { "rate_mbps": 3 } },
    { "name": "rate2", "impairment": { "rate_mbps": 2 } },
    { "name": "rate1.5", "impairment": { "rate_mbps": 1.5 } }
  ]
}
